{
  "$schema": "https://json-schema.org/draft/2020-12/schema",
  "title": "Lodestar Guard Report",
  "type": "object",
  "required": ["status", "summary", "checks"],
  "properties": {
    "status": { "enum": ["pass", "fail", "warning"] },
    "summary": { "type": "string", "minLength": 1 },
    "scope": { "type": "string" },
    "checks": {
      "type": "array",
      "minItems": 1,
      "items": {
        "type": "object",
        "required": ["name", "status"],
        "properties": {
          "name": { "type": "string", "minLength": 1 },
          "status": { "enum": ["pass", "fail", "warning", "not_applicable"] },
          "detail": { "type": "string" }
        }
      }
    }
  }
}
